{
  "interface_version": 1,
  "invocation": {
    "caller": "user",
    "harness": "claude-code",
    "mode": "direct",
    "session_id": "session-example-1"
  },
  "plugin_version": "0.1.2",
  "reason": "the scope doc holds a line the ledger reader cannot tag: line 7 '- maybe later'",
  "report_only": false,
  "run_dir": "/tmp/station-runs/run-0001",
  "run_id": "run-0001",
  "station": "inspect-v2",
  "status": "stopped",
  "stop_tag": "ledger-refused",
  "writes": [
    {
      "kind": "run_artifact",
      "path": "/tmp/station-runs/run-0001/result.json",
      "sha256_after": null,
      "sha256_before": null
    }
  ],
  "wrote_nothing": true
}
