{
  "interface_version": 1,
  "invocation": {
    "caller": "user",
    "harness": "claude-code",
    "mode": "direct",
    "session_id": "session-example-1"
  },
  "plugin_version": "0.1.2",
  "reason": "the lane cannot run: run-0001-gpt-astra answered lane-unavailable (codex not on PATH). Nothing from this lane is triaged; re-ask the owner",
  "report_only": false,
  "run_dir": "/tmp/station-runs/run-0001",
  "run_id": "run-0001",
  "station": "inspect-v2",
  "station_result": {
    "build_doc": "/tmp/widget-workspace/docs/plans/2026-09-22-widget.md",
    "chat": "INSPECT: /tmp/widget-workspace/docs/plans/2026-09-22-widget.md\nStopped: lane-down\nReason: the lane cannot run: run-0001-gpt-astra answered lane-unavailable (codex not on PATH). Nothing from this lane is triaged; re-ask the owner\nStamp: none written\nNext: read the reason.\n",
    "stamp": null,
    "stamp_written": false
  },
  "status": "stopped",
  "stop_tag": "lane-down",
  "writes": [
    {
      "kind": "run_artifact",
      "path": "/tmp/station-runs/run-0001/checkpoint.json",
      "sha256_after": "ffffffffffffffffffffffffffffffffffffffffffffffffffffffffffffffff",
      "sha256_before": null
    }
  ],
  "wrote_nothing": true
}
